{
  "id": "estandartes:unit/lanceros_escoceses",
  "name": "Lanceros escoceses",
  "archetype": "PolearmInfantry",
  "capabilities": [
    "AntiCavalryFormation",
    "Shield"
  ],
  "weapons": [
    "estandartes:weapon/lanza_larga",
    "estandartes:weapon/espada_corta"
  ],
  "armor": {
    "cut": 0.2,
    "pierce": 0.15,
    "blunt": 0.1
  },
  "stats": {
    "health": 100,
    "mountHealth": 0,
    "morale": 70,
    "discipline": 70,
    "walk": 1.4,
    "run": 5.2
  },
  "personality": {
    "courage": [
      0.6,
      0.9
    ],
    "aggression": [
      0.5,
      0.85
    ],
    "skill": [
      0.3,
      0.7
    ],
    "discipline": [
      0.5,
      0.85
    ],
    "experience": [
      0.3,
      0.7
    ]
  },
  "squadSize": 100,
  "cost": 8,
  "era": "medieval",
  "culture": "escocesa"
}
