{
  "id": "estandartes:unit/paveseros",
  "name": "Paveseros",
  "archetype": "PolearmInfantry",
  "capabilities": [
    "Pavise",
    "Shield"
  ],
  "weapons": [
    "estandartes:weapon/lanza",
    "estandartes:weapon/espada_corta"
  ],
  "armor": {
    "cut": 0.35,
    "pierce": 0.25,
    "blunt": 0.2
  },
  "stats": {
    "health": 100,
    "mountHealth": 0,
    "morale": 55,
    "discipline": 60,
    "walk": 1.2,
    "run": 4.5
  },
  "personality": {
    "courage": [
      0.4,
      0.7
    ],
    "aggression": [
      0.2,
      0.5
    ],
    "skill": [
      0.3,
      0.6
    ],
    "discipline": [
      0.4,
      0.8
    ],
    "experience": [
      0.2,
      0.6
    ]
  },
  "squadSize": 40,
  "cost": 7,
  "era": "medieval"
}
