{
  "id": "estandartes:unit/fyrd",
  "name": "Fyrd (milicia)",
  "archetype": "PolearmInfantry",
  "capabilities": [
    "Shield",
    "ShieldWall"
  ],
  "weapons": [
    "estandartes:weapon/lanza",
    "estandartes:weapon/daga"
  ],
  "armor": {
    "cut": 0.15,
    "pierce": 0.1,
    "blunt": 0.1
  },
  "stats": {
    "health": 100,
    "mountHealth": 0,
    "morale": 45,
    "discipline": 30,
    "walk": 1.4,
    "run": 5.5
  },
  "personality": {
    "courage": [
      0.3,
      0.7
    ],
    "aggression": [
      0.3,
      0.7
    ],
    "skill": [
      0.1,
      0.4
    ],
    "discipline": [
      0.1,
      0.4
    ],
    "experience": [
      0.0,
      0.3
    ]
  },
  "squadSize": 80,
  "cost": 4,
  "era": "medieval",
  "culture": "noroccidental_temprana"
}
