{
  "id": "estandartes:unit/ballesteros",
  "name": "Ballesteros",
  "archetype": "Ranged",
  "capabilities": [
    "Reload",
    "Pavise"
  ],
  "weapons": [
    "estandartes:weapon/ballesta",
    "estandartes:weapon/espada_corta"
  ],
  "armor": {
    "cut": 0.35,
    "pierce": 0.25,
    "blunt": 0.2
  },
  "stats": {
    "health": 100,
    "mountHealth": 0,
    "morale": 50,
    "discipline": 60,
    "walk": 1.3,
    "run": 5.2
  },
  "personality": {
    "courage": [
      0.3,
      0.7
    ],
    "aggression": [
      0.2,
      0.5
    ],
    "skill": [
      0.4,
      0.8
    ],
    "discipline": [
      0.4,
      0.8
    ],
    "experience": [
      0.3,
      0.7
    ]
  },
  "squadSize": 60,
  "cost": 10,
  "era": "medieval"
}
