{
  "id": "estandartes:unit/arqueros_a_caballo",
  "name": "Arqueros a caballo",
  "archetype": "LightCavalry",
  "capabilities": [
    "Mounted",
    "HorseArcher"
  ],
  "weapons": [
    "estandartes:weapon/arco_compuesto",
    "estandartes:weapon/espada"
  ],
  "armor": {
    "cut": 0.25,
    "pierce": 0.15,
    "blunt": 0.15
  },
  "stats": {
    "health": 100,
    "mountHealth": 200,
    "morale": 55,
    "discipline": 55,
    "walk": 4.0,
    "run": 13
  },
  "personality": {
    "courage": [
      0.4,
      0.8
    ],
    "aggression": [
      0.4,
      0.8
    ],
    "skill": [
      0.5,
      0.9
    ],
    "discipline": [
      0.4,
      0.7
    ],
    "experience": [
      0.4,
      0.8
    ]
  },
  "squadSize": 30,
  "cost": 18,
  "era": "medieval"
}
