{
  "id": "estandartes:unit/huscarles",
  "name": "Huscarles",
  "archetype": "ShockInfantry",
  "capabilities": [
    "Shield",
    "ShieldWall"
  ],
  "weapons": [
    "estandartes:weapon/hacha_danesa",
    "estandartes:weapon/espada"
  ],
  "armor": {
    "cut": 0.55,
    "pierce": 0.45,
    "blunt": 0.3
  },
  "stats": {
    "health": 100,
    "mountHealth": 0,
    "morale": 85,
    "discipline": 80,
    "walk": 1.3,
    "run": 5.0
  },
  "personality": {
    "courage": [
      0.7,
      0.95
    ],
    "aggression": [
      0.5,
      0.9
    ],
    "skill": [
      0.6,
      0.9
    ],
    "discipline": [
      0.7,
      0.95
    ],
    "experience": [
      0.6,
      0.9
    ]
  },
  "squadSize": 40,
  "cost": 15,
  "era": "medieval",
  "culture": "noroccidental_temprana"
}
