{
  "id": "estandartes:unit/jinetes",
  "name": "Jinetes",
  "archetype": "LightCavalry",
  "capabilities": [
    "Mounted",
    "Shield",
    "Javelins"
  ],
  "weapons": [
    "estandartes:weapon/lanza_ligera",
    "estandartes:weapon/jabalina",
    "estandartes:weapon/espada"
  ],
  "armor": {
    "cut": 0.2,
    "pierce": 0.15,
    "blunt": 0.15
  },
  "stats": {
    "health": 100,
    "mountHealth": 200,
    "morale": 60,
    "discipline": 55,
    "walk": 3.5,
    "run": 12.5
  },
  "personality": {
    "courage": [
      0.5,
      0.85
    ],
    "aggression": [
      0.5,
      0.9
    ],
    "skill": [
      0.5,
      0.85
    ],
    "discipline": [
      0.4,
      0.7
    ],
    "experience": [
      0.4,
      0.8
    ]
  },
  "squadSize": 30,
  "cost": 15,
  "era": "medieval",
  "culture": "iberica_cristiana"
}
